{
  "title": "Chapter 7. The Breakwater",
  "modified": "2026-09-19T09:30:00.000Z",
  "device": {
    "id": "urn:uuid:8f1d6d4e-3a7b-4f2e-9c58-6b0d9a2e1f47",
    "name": "Enve OPDS Lab"
  },
  "progression": 0.6127,
  "references": [
    "OEBPS/chapter7.xhtml#:~:text=the%20breakwater%20held",
    "OEBPS/chapter7.xhtml#p118",
    "#page=214",
    "urn:lab:unresolvable-reference"
  ]
}
