{
  "title": "Chapter 11. The Long Quay",
  "modified": "2026-09-19T09:05:00.000Z",
  "device": {
    "id": "urn:uuid:2d5c7e91-4b6a-4c3d-8e17-5a9f0b1c2d34",
    "name": "Enve OPDS Lab (second reader)"
  },
  "progression": 0.7712,
  "references": [
    "chapter11.xhtml#:~:text=the%20quay%20ran%20on",
    "chapter11.xhtml#par402"
  ]
}
